{
  "$schema": "https://json-schema.org/draft/2020-12/schema",
  "$id": "https://schemas.yet-ai.example/contracts/engine/project-memory-note.schema.json",
  "title": "Project Memory Note",
  "description": "Engine-owned local project memory contract. Notes are user-created sanitized bounded text only; no raw provider responses, secrets, private paths, file bodies, embeddings, background index, workspace scan, assistant-triggered save, browser storage persistence, or cloud sync.",
  "type": "object",
  "additionalProperties": false,
  "required": [
    "id",
    "title",
    "text",
    "tags",
    "source",
    "createdAt",
    "updatedAt"
  ],
  "properties": {
    "id": {
      "$ref": "#/$defs/memoryId"
    },
    "title": {
      "$ref": "#/$defs/title"
    },
    "text": {
      "$ref": "#/$defs/noteText"
    },
    "tags": {
      "$ref": "#/$defs/tags"
    },
    "source": {
      "type": "string",
      "const": "manual"
    },
    "createdAt": {
      "$ref": "#/$defs/timestamp"
    },
    "updatedAt": {
      "$ref": "#/$defs/timestamp"
    }
  },
  "$defs": {
    "protocolVersion": {
      "type": "string",
      "const": "2026-06-17"
    },
    "memoryId": {
      "type": "string",
      "minLength": 1,
      "maxLength": 128,
      "pattern": "^(?!.*(?:[Aa][Pp][Ii][-_]?[Kk][Ee][Yy]|[Tt][Oo][Kk][Ee][Nn]|[Ss][Ee][Cc][Rr][Ee][Tt]|[Ss][Kk]-(?:[Pp][Rr][Oo][Jj]-)?[A-Za-z0-9_-]{8,}))[A-Za-z0-9][A-Za-z0-9_-]{0,127}$"
    },
    "timestamp": {
      "type": "string",
      "format": "date-time",
      "minLength": 20,
      "maxLength": 32,
      "pattern": "^\\d{4}-\\d{2}-\\d{2}T\\d{2}:\\d{2}:\\d{2}(?:\\.\\d{1,6})?Z$"
    },
    "safeText": {
      "type": "string",
      "pattern": "^(?![\\s\\S]*(?:[Aa][Pp][Ii][-_ ]?[Kk][Ee][Yy]|[Aa][Uu][Tt][Hh][Oo][Rr][Ii][Zz][Aa][Tt][Ii][Oo][Nn]|[Bb][Ee][Aa][Rr][Ee][Rr]|[Tt][Oo][Kk][Ee][Nn]|[Ss][Ee][Cc][Rr][Ee][Tt]|[Pp][Aa][Ss][Ss][Ww][Oo][Rr][Dd]|[Cc][Oo][Oo][Kk][Ii][Ee]|[Pp][Kk][Cc][Ee]|[Rr][Ee][Ff][Rr][Ee][Ss][Hh]|[Aa][Cc][Cc][Ee][Ss][Ss][-_ ]?[Tt][Oo][Kk][Ee][Nn]|[Aa][Uu][Tt][Hh][-_ ]?[Cc][Oo][Dd][Ee]|[Rr][Aa][Ww][-_ ]?(?:[Pp][Rr][Oo][Mm][Pp][Tt]|[Cc][Oo][Mm][Mm][Aa][Nn][Dd]|[Dd][Uu][Mm][Pp]|[Oo][Uu][Tt][Pp][Uu][Tt]|[Ff][Ii][Ll][Ee]|[Ww][Oo][Rr][Kk][Ss][Pp][Aa][Cc][Ee])|[Pp][Rr][Oo][Vv][Ii][Dd][Ee][Rr][-_ ]?(?:[Rr][Ee][Ss][Pp][Oo][Nn][Ss][Ee]|[Bb][Oo][Dd][Yy])|[Cc][Rr][Ee][Dd][Ee][Nn][Tt][Ii][Aa][Ll]|[Ff][Ii][Ll][Ee][-_ ]?[Bb][Oo][Dd][Yy]|[Ff][Ii][Ll][Ee][-_ ]?[Cc][Oo][Nn][Tt][Ee][Nn][Tt]|[Ww][Oo][Rr][Kk][Ss][Pp][Aa][Cc][Ee][-_ ]?(?:[Ff][Ii][Ll][Ee]|[Cc][Oo][Nn][Tt][Ee][Nn][Tt])|[Ee][Mm][Bb][Ee][Dd][Dd][Ii][Nn][Gg][Ss]?|[Ii][Nn][Dd][Ee][Xx](?:[Ii][Nn][Gg])?|[Ww][Oo][Rr][Kk][Ss][Pp][Aa][Cc][Ee][-_ ]?[Ss][Cc][Aa][Nn]|[Aa][Ss][Ss][Ii][Ss][Tt][Aa][Nn][Tt][-_ ]?[Tt][Rr][Ii][Gg][Gg][Ee][Rr][Ee][Dd]|(?:^|[^A-Za-z0-9_-])[Ss][Kk]-(?:[Pp][Rr][Oo][Jj]-)?[A-Za-z0-9_-]{8,}|/[Uu][Ss][Ee][Rr][Ss](?=/|$|[^A-Za-z0-9_])|/[Hh][Oo][Mm][Ee](?=/|$|[^A-Za-z0-9_])|/[Tt][Mm][Pp](?=/|$|[^A-Za-z0-9_])|/[Ee][Tt][Cc](?=/|$|[^A-Za-z0-9_])|/[Oo][Pp][Tt](?=/|$|[^A-Za-z0-9_])|/[Mm][Nn][Tt](?=/|$|[^A-Za-z0-9_])|/[Vv][Aa][Rr](?=/|$|[^A-Za-z0-9_])|/[Vv][Oo][Ll][Uu][Mm][Ee][Ss](?=/|$|[^A-Za-z0-9_])|/[Pp][Rr][Ii][Vv][Aa][Tt][Ee](?=/|$|[^A-Za-z0-9_])|[A-Za-z]:(?:/|\\\\)|~/|(?:[Aa][Uu][Tt][Hh]|[Cc][Rr][Ee][Dd][Ee][Nn][Tt][Ii][Aa][Ll][Ss]?)\\.json|[Bb][Ee][Gg][Ii][Nn] [A-Za-z ]*[Pp][Rr][Ii][Vv][Aa][Tt][Ee] [Kk][Ee][Yy]))[\\s\\S]*$"
    },
    "title": {
      "allOf": [
        {
          "$ref": "#/$defs/safeText"
        },
        {
          "type": "string",
          "minLength": 1,
          "maxLength": 120
        }
      ]
    },
    "noteText": {
      "allOf": [
        {
          "$ref": "#/$defs/safeText"
        },
        {
          "type": "string",
          "minLength": 1,
          "maxLength": 8000
        }
      ]
    },
    "contextText": {
      "allOf": [
        {
          "$ref": "#/$defs/safeText"
        },
        {
          "type": "string",
          "minLength": 1,
          "maxLength": 4000
        }
      ]
    },
    "tag": {
      "type": "string",
      "minLength": 1,
      "maxLength": 32,
      "pattern": "^(?!.*(?:[Aa][Pp][Ii][-_]?[Kk][Ee][Yy]|[Tt][Oo][Kk][Ee][Nn]|[Ss][Ee][Cc][Rr][Ee][Tt]|[Pp][Aa][Ss][Ss][Ww][Oo][Rr][Dd]))[A-Za-z0-9][A-Za-z0-9_-]{0,31}$"
    },
    "tags": {
      "type": "array",
      "maxItems": 10,
      "uniqueItems": true,
      "items": {
        "$ref": "#/$defs/tag"
      }
    },
    "query": {
      "allOf": [
        {
          "$ref": "#/$defs/safeText"
        },
        {
          "type": "string",
          "minLength": 1,
          "maxLength": 160
        }
      ]
    },
    "note": {
      "type": "object",
      "additionalProperties": false,
      "required": [
        "id",
        "title",
        "text",
        "tags",
        "source",
        "createdAt",
        "updatedAt"
      ],
      "properties": {
        "id": {
          "$ref": "#/$defs/memoryId"
        },
        "title": {
          "$ref": "#/$defs/title"
        },
        "text": {
          "$ref": "#/$defs/noteText"
        },
        "tags": {
          "$ref": "#/$defs/tags"
        },
        "source": {
          "type": "string",
          "const": "manual"
        },
        "createdAt": {
          "$ref": "#/$defs/timestamp"
        },
        "updatedAt": {
          "$ref": "#/$defs/timestamp"
        }
      }
    }
  }
}
